position,name,title,created_utc,author,subreddit,permalink
1,t3_hp6x2w,Balding has caused me so much depression. So I went bald.,1594457955.0,cmyes,pics,/r/pics/comments/hp6x2w/balding_has_caused_me_so_much_depression_so_i/
2,t3_hp8147,Sneakily helpful :),1594464413.0,HiddenPictures,MadeMeSmile,/r/MadeMeSmile/comments/hp8147/sneakily_helpful/
3,t3_hp87se,Making someone’s day extra-special,1594465471.0,CanadianGeeseScareMe,nextfuckinglevel,/r/nextfuckinglevel/comments/hp87se/making_someones_day_extraspecial/
4,t3_hp616o,Quiet kids are too good at roasting,1594452736.0,AJ7123,memes,/r/memes/comments/hp616o/quiet_kids_are_too_good_at_roasting/
5,t3_hpd2vn,Merkel says the coronavirus pandemic has exposed leaders who rely on 'fact-denying populism',1594485573.0,NextHammer,worldnews,/r/worldnews/comments/hpd2vn/merkel_says_the_coronavirus_pandemic_has_exposed/
6,t3_hp8kf9,This is how big kiwis are,1594467373.0,cferrios,interestingasfuck,/r/interestingasfuck/comments/hp8kf9/this_is_how_big_kiwis_are/
7,t3_hpfsmz,not a furry btw,1594494868.0,solidsnakeeeeeeeeee,memes,/r/memes/comments/hpfsmz/not_a_furry_btw/
8,t3_hp9ls9,Cosy Couple,1594472510.0,OddlyGruntled,aww,/r/aww/comments/hp9ls9/cosy_couple/
9,t3_hp815o,"Bill Gates calls for COVID-19 meds to go to people who need them, not 'highest bidder'",1594464420.0,tanishvva,worldnews,/r/worldnews/comments/hp815o/bill_gates_calls_for_covid19_meds_to_go_to_people/
10,t3_hp958r,You’re damn right Sweden!,1594470328.0,duy1008,memes,/r/memes/comments/hp958r/youre_damn_right_sweden/
11,t3_hpbqdn,This guy went back to look over the burned wreckage of his house a week after it burned down. Little did he know that he would also find his cat who was lost during the fire..,1594480896.0,FunPeach0,PublicFreakout,/r/PublicFreakout/comments/hpbqdn/this_guy_went_back_to_look_over_the_burned/
12,t3_hp7whk,It is true tho,1594463673.0,xDerJulien,dankmemes,/r/dankmemes/comments/hp7whk/it_is_true_tho/
13,t3_hp9320,"""Please Scream Inside Your Heart""",1594470032.0,zeromig,funny,/r/funny/comments/hp9320/please_scream_inside_your_heart/
14,t3_hp8jyx,It's humid and I hate it,1594467306.0,kevinowdziej,WhitePeopleTwitter,/r/WhitePeopleTwitter/comments/hp8jyx/its_humid_and_i_hate_it/
15,t3_hpbd99,One from a series of reaction gifs created by the GoW dev team,1594479589.0,Dexter_davis,gaming,/r/gaming/comments/hpbd99/one_from_a_series_of_reaction_gifs_created_by_the/
16,t3_hpb12e,Birdie got no chill,1594478291.0,Usama0921,memes,/r/memes/comments/hpb12e/birdie_got_no_chill/
17,t3_hpcq5q,Single man Peter Mutabaz adopts 13yo boy after his adoptive parents abandoned him in a hospital,1594484386.0,Unicornglitteryblood,pics,/r/pics/comments/hpcq5q/single_man_peter_mutabaz_adopts_13yo_boy_after/
18,t3_hp7y2o,"I'm not greedy, you're wrong",1594463907.0,SkrooImperator,BlackPeopleTwitter,/r/BlackPeopleTwitter/comments/hp7y2o/im_not_greedy_youre_wrong/
19,t3_hpamws,How Masks And Social Distancing Works,1594476771.0,PepeFrogLive,coolguides,/r/coolguides/comments/hpamws/how_masks_and_social_distancing_works/
20,t3_hp68tl,Cursed itch on the roof of the mouth.,1594453975.0,TrashDaaddy,cursedcomments,/r/cursedcomments/comments/hp68tl/cursed_itch_on_the_roof_of_the_mouth/
21,t3_hpb391,The pair on this lady,1594478528.0,AmOdd,nextfuckinglevel,/r/nextfuckinglevel/comments/hpb391/the_pair_on_this_lady/
22,t3_hpgd5a,"I adopted Francis (14yrs) last year and I've posted a few times about our journey together. I bought a cart for him last week so he could feel the wind on his face and two fellow Redditors, Ryan and Jill (all the way from California!) sent him the coolest umbrella to pimp up his ride! TY ❤️❤️❤️❤️",1594496821.0,zenmin75,aww,/r/aww/comments/hpgd5a/i_adopted_francis_14yrs_last_year_and_ive_posted/
23,t3_hp6qcv,Spend 3 days to make a QR code,1594456809.0,Dr_Whoooo,Unexpected,/r/Unexpected/comments/hp6qcv/spend_3_days_to_make_a_qr_code/
24,t3_hpcfjp,It's real REDACTED hours,1594483389.0,CluckCold,dankmemes,/r/dankmemes/comments/hpcfjp/its_real_redacted_hours/
25,t3_hp722l,mhmm it is satisfactory,1594458768.0,dont_mind_me127,memes,/r/memes/comments/hp722l/mhmm_it_is_satisfactory/
